{
  "lead_id": "lead_demo_001",
  "created_at": "2026-05-18T20:00:00-05:00",
  "updated_at": "2026-05-18T20:05:00-05:00",
  "source": "whatsapp",
  "wa_phone": "521XXXXXXXXXX",
  "profile_name": "Demo User",
  "name": "Dra. Demo",
  "business_name": "Clinica Demo Norte",
  "industry": "clinica",
  "city": "Monterrey",
  "main_problem": "Pierden mensajes de pacientes fuera de horario",
  "service_interest": "WhatsApp AI assistant",
  "lead_status": "qualified",
  "urgency": "medium",
  "budget_range": "Por definir",
  "preferred_contact_time": "Tardes",
  "appointment_date": "2026-05-20T16:00:00-06:00",
  "appointment_status": "scheduled",
  "conversation_summary": "Lead interesado en automatizar respuestas y citas para una clinica.",
  "handoff_required": false,
  "opt_out": false,
  "last_message_at": "2026-05-18T20:05:00-05:00",
  "assigned_to": "Scalvia team",
  "notes": "Solicito demo breve."
}
